{
  "schemaVersion": "1.0.0",
  "generatedAt": "2026-01-19",
  "source": {
    "generator": "Gemini 3",
    "notes": "Deep research on discrete and combinatorial architecture"
  },
  "projects": [
    {
      "id": "flight-assembled-architecture-2011",
      "title": "Flight Assembled Architecture",
      "year": 2011,
      "authors": [
        "Gramazio Kohler Research (ETH Zürich)",
        "Raffaello D'Andrea"
      ],
      "institutionOrPractice": "ETH Zürich (Gramazio Kohler Research; Flying Machine Arena)",
      "location": "Orléans, France (FRAC Centre exhibition context)",
      "projectType": "robotic discrete construction (aerial assembly demonstrator)",
      "tags": [
        "discrete architecture",
        "robotic construction",
        "aerial robotics",
        "automated assembly",
        "block placement",
        "computational design"
      ],
      "summary": "Flight Assembled Architecture is an experimental construction demonstrator in which autonomous quadrotors place discrete blocks to form a freestanding architectural-scale structure, foregrounding computation, coordination, and logistics as primary design media.",
      "analyticalCaption": "The project reframes architectural form as an emergent consequence of multi-agent assembly constraints—payload capacity, collision avoidance, and spatial sequencing—thereby coupling geometry to a robotic process model rather than to static fabrication drawings.",
      "methods": {
        "computational": [
          "multi-agent path planning",
          "discrete stacking logic",
          "process-aware design (assembly sequencing and feasibility constraints)"
        ],
        "assemblyFabrication": [
          "quadrotor-mediated pick-and-place of discrete blocks",
          "incremental on-site assembly",
          "automated coordination and positioning"
        ]
      },
      "images": [
        {
          "url": "https://www.flyingmachinearena.ethz.ch/data/gallery/frac-centre/faa_tower_full.jpg",
          "alt": "Overall view of the assembled tower produced by aerial placement of discrete blocks.",
          "role": "overall",
          "sourceName": "ETH Zürich Flying Machine Arena",
          "sourceUrl": "https://www.flyingmachinearena.ethz.ch/project/frac-centre/",
          "licenseHint": "unknown"
        },
        {
          "url": "https://www.flyingmachinearena.ethz.ch/data/gallery/frac-centre/faa_place_brick.jpg",
          "alt": "A quadrotor places a block onto the growing structure during aerial construction.",
          "role": "detail",
          "sourceName": "ETH Zürich Flying Machine Arena",
          "sourceUrl": "https://www.flyingmachinearena.ethz.ch/project/frac-centre/",
          "licenseHint": "unknown"
        },
        {
          "url": "https://www.flyingmachinearena.ethz.ch/data/gallery/frac-centre/faa_two_quads.jpg",
          "alt": "Two quadrotors fly in coordination to deliver and position blocks in parallel.",
          "role": "diagram",
          "sourceName": "ETH Zürich Flying Machine Arena",
          "sourceUrl": "https://www.flyingmachinearena.ethz.ch/project/frac-centre/",
          "licenseHint": "unknown"
        }
      ],
      "references": [
        {
          "type": "web",
          "citation": "ETH Zürich Flying Machine Arena. “Flight Assembled Architecture (FRAC Centre project page).”",
          "url": "https://www.flyingmachinearena.ethz.ch/project/frac-centre/"
        }
      ]
    },
    {
      "id": "icd-itke-research-pavilion-2014-15",
      "title": "ICD/ITKE Research Pavilion 2014–15",
      "year": 2015,
      "authors": [
        "Achim Menges",
        "Jan Knippers",
        "ICD/ITKE University of Stuttgart"
      ],
      "institutionOrPractice": "University of Stuttgart (ICD/ITKE)",
      "location": "Stuttgart, Germany",
      "projectType": "robotically fabricated composite shell pavilion",
      "tags": [
        "digital materials",
        "computational design",
        "robotic fabrication",
        "fiber composites",
        "lightweight structures",
        "temporary pavilion"
      ],
      "summary": "The ICD/ITKE Research Pavilion 2014–15 demonstrates a material-efficient fiber-composite architectural shell produced through robotic fabrication that progressively stiffens an initially flexible formwork, integrating material behavior with computational design intent.",
      "analyticalCaption": "Rather than treating material as a passive substrate, the pavilion operationalizes a digitally controlled reinforcement logic where structural performance, fabrication access, and geometric continuity are co-optimized through process-driven design.",
      "methods": {
        "computational": [
          "biomimetic design workflow",
          "structural simulation-informed geometry",
          "robotic toolpath planning for in-situ reinforcement"
        ],
        "assemblyFabrication": [
          "robotic fiber placement / internal reinforcement on pneumatic formwork",
          "incremental stiffening during fabrication",
          "lightweight on-site pavilion assembly"
        ]
      },
      "images": [
        {
          "url": "https://images.adsttc.com/media/images/55ac/ee64/e58e/ce12/db00/0242/newsletter/ICD-ITKE_RP13-14_Image10.jpg?1437396574",
          "alt": "Overall exterior view of the ICD/ITKE Research Pavilion shell.",
          "role": "overall",
          "sourceName": "ArchDaily",
          "sourceUrl": "https://www.archdaily.com/770516/icd-itke-research-pavilion-2014-15-icd-itke-university-of-stuttgart",
          "licenseHint": "unknown"
        },
        {
          "url": "https://images.adsttc.com/media/images/55ac/ef18/e58e/ce12/db00/0249/newsletter/ICD-ITKE_RP14-15_Process05.jpg?1437396755",
          "alt": "Fabrication/process view illustrating the pneumatic formwork and composite reinforcement workflow.",
          "role": "detail",
          "sourceName": "ArchDaily",
          "sourceUrl": "https://www.archdaily.com/770516/icd-itke-research-pavilion-2014-15-icd-itke-university-of-stuttgart",
          "licenseHint": "unknown"
        },
        {
          "url": "https://images.adsttc.com/media/images/55ac/ef9e/e58e/ce12/db00/024f/medium_jpg/ICD-ITKE_RP14-15_Process14.jpg?1437396887",
          "alt": "Process/analysis image related to sensing or control interfaces used in adaptive fabrication.",
          "role": "diagram",
          "sourceName": "ArchDaily",
          "sourceUrl": "https://www.archdaily.com/770516/icd-itke-research-pavilion-2014-15-icd-itke-university-of-stuttgart",
          "licenseHint": "unknown"
        }
      ],
      "references": [
        {
          "type": "web",
          "citation": "ArchDaily. “ICD/ITKE Research Pavilion 2014-15 / ICD/ITKE University of Stuttgart.” Published 20 Jul 2015.",
          "url": "https://www.archdaily.com/770516/icd-itke-research-pavilion-2014-15-icd-itke-university-of-stuttgart"
        }
      ]
    },
    {
      "id": "gc-prostho-museum-research-center-2010",
      "title": "GC Prostho Museum Research Center",
      "year": 2010,
      "authors": [
        "Kengo Kuma & Associates"
      ],
      "institutionOrPractice": "Kengo Kuma & Associates",
      "location": "Kasugai (Aichi Prefecture), Japan",
      "projectType": "built interlocking timber lattice building",
      "tags": [
        "interlocking assembly",
        "reversible joinery",
        "kit-of-parts logic",
        "lattice structures",
        "wood construction",
        "combinatorial architecture"
      ],
      "summary": "The GC Prostho Museum Research Center translates the logic of the traditional Japanese Cidori (Chidori) toy into a building-scale timber lattice, constructing architectural space through the repetition and combination of small interlocking units without metal fasteners.",
      "analyticalCaption": "By scaling a discrete joint grammar into an inhabitable system, the project exemplifies combinatorial architecture in which structural capacity, enclosure, and display infrastructure emerge from a unified unit-based assembly logic.",
      "methods": {
        "computational": [
          "unit-based spatial/structural design",
          "grid and joint-logic development",
          "coordination of repetition and variation within a discrete lattice"
        ],
        "assemblyFabrication": [
          "manual assembly of interlocking timber members",
          "fastener-free joinery logic (no nails/metal fittings in the Cidori principle)",
          "modular lattice erection and fit-up"
        ]
      },
      "images": [
        {
          "url": "https://images.adsttc.com/media/images/5004/e0bb/28ba/0d4e/8d00/0ad0/newsletter/stringio.jpg?1414027311",
          "alt": "Overall view of the GC Prostho Museum Research Center lattice structure.",
          "role": "overall",
          "sourceName": "ArchDaily",
          "sourceUrl": "https://www.archdaily.com/199442/gc-prostho-museum-research-center-kengo-kuma-associates",
          "licenseHint": "unknown"
        },
        {
          "url": "https://images.adsttc.com/media/images/5004/e0c9/28ba/0d4e/8d00/0ad4/medium_jpg/stringio.jpg?1414027319",
          "alt": "Interior view emphasizing the spatial density and visual porosity of the timber grid.",
          "role": "detail",
          "sourceName": "ArchDaily",
          "sourceUrl": "https://www.archdaily.com/199442/gc-prostho-museum-research-center-kengo-kuma-associates",
          "licenseHint": "unknown"
        },
        {
          "url": "https://images.adsttc.com/media/images/5004/e0d2/28ba/0d4e/8d00/0ad7/medium_jpg/stringio.jpg?1414027324",
          "alt": "Elevation/diagrammatic representation associated with the building’s lattice system.",
          "role": "diagram",
          "sourceName": "ArchDaily",
          "sourceUrl": "https://www.archdaily.com/199442/gc-prostho-museum-research-center-kengo-kuma-associates",